listing,price
Boho Light Tan w/Silver Handbag/ Shoulder Bag,22.0
"NWT Kate Spade Vibrant Black/White Neda Wallet
          
      NWT",118.0
🛍️BUNDLE ONLY ITEM🛍️ Faux Leather Purse Set,3.0
"Mate “Makin’ Moves” Tote Bag Size 14x‎ 13.25 Inches NWT
          
      NWT",10.0
"NWT Coach Pouch Wristlet Pink $118 metallic Leather
          
      NWT",76.0
Tommy Bahama Black Tropical Women's Waterproof Nylon Bag,18.0
Braciano Snap Wallet Colorful Circle Patterned Case.,14.0
Authentic Louis Vuitton Damier Ebene Pouch,438.0
"Montana West Embroidered Concealed Carry Tote with Wallet Set Turquoise NWT
          
      NWT",90.0
Fossil Leather Liza Womens Zip Around Clutch Wallet Bifold,28.0
"JINGPINPIJU shoulder bag/crossbody New
          
      NWT",30.0
Valentino Garavani Silk Floral Bag,475.0
"MZ Wallace Small Crosby Barrel
          
      NWT",350.0
LOUIS VUITTON Favorite MM Monogram Bag,1430.0
"NWT MICHAEL KORS Large Red Mercer Tote Bag
          
      NWT",189.0
Nine West Womens Black Casual Everyday Flap Closure Backpack Modern Versatile,31.0
Coach authentic trackpack backpack black leather excellent condition,65.0
Women's Betsey Johnson Wallet Black Red Lips Print,18.0
Protocol Carry-On Travel Shoulder Bag 17x12 Black Two Compartment,23.0
Michael Kors Crossbody Purse,65.0
Kate Spade Wristlet,32.0
Vintage MM Morris Moskowitz Faille Satin Black Evening Purse/ Handbag 9x6x3” EUC,30.0
"NWT JULES KAE - MIA BAG
          
      NWT",65.0
Michael Kors Grey Leather‎ Crossbody,50.0
lululemon athletica Midnight Black Crossbody Bag-2L,48.0
Louis Vuitton Monogram Portefeuille Elise Trifold Wallet,59.0
"Nine West Cibrina Done Satchel Bag in Milk White nwt
          
      NWT",56.0
Kate Spade Maroon Red Crimson Shoulder/clutch Purse Gold Pyramid‎ Turn Lock,10.0
Hermès Kelly Pochette in Shiny Niloticus,499.0
Kooba Sage Green Calabasas Leather Convertible Backpack Shoulder Bag Travel Work,50.0
Vintage FOSSIL Black Leather CARSON Top Zip Crossbody Purse Bag,32.0
Prana little seed hip pack canvas belt bag cream Brown Purse Fanny Pack,13.0
Michael Kors Grayson Black Patent Monogram Satchel Bag,100.0
Kate Spade Bow Puffer Clutch,40.0
Evening PROM Bag NWOT crossbody or clutch Rhinestone 11” x 9” w/ 22” strap PROM,25.0
"BETSEY‎ JOHNSON Womens NWT Crossbody Satchel Top-Handle Bag/Card Case/Wide Strap
          
      NWT",75.0
Coach Black Leather Wristlet,39.0
"NWT BCBG Pairs Large Tote w/Twilly Accents
          
      NWT",60.0
Aimee Kestenberg Burgundy Leather Backpack,170.0
"New Michael Kors MK Nicole Medium Shoulder Bag Tote Purse Vanilla White
          
      NWT",152.0
Skip Hop Greenwich Chic Diaper Bag Backpack Beige Large Unisex‎,22.0
"MICHAEL KORS Jaycee Medium zip pocket Pebbled Leather Backpack BLACK color
          
      Boutique",117.0
Jamaican Shoulder Bag Lakhay Collection 100% Hemp ‎ Made In Nepal,15.0
"Kate Spade RARE Margareta Wilson‎ Rd Tote w/ Lg Drewe NWT
          
      NWT",246.0
Michael Kors black Fulton Carryall wallet,30.0
Lauren Ralph Lauren Black Croc-Embossed Shoulder Bag,75.0
KATE SPADE Auden convertible black leather crossbody/shoulder bag w/ gold chain,40.0
NWT Rowallan Tartan Plaid Wristlet,24.0
"Wilson Leather Pelle Studio HAND TOOLDED Brown & Blue Leather Carry On Duffle
          
      NWT",285.0
Vilenca Holland Cognac Leather Wallet,70.0
Dooney & Bourke Magenta and White Chevron Crossbody Bag Pebbled Leather,45.0
Lululemon Carry Onward Rucksack *12L,105.0
Patricia Nash Nova Crossbody - NWOT,65.0
"Michael Kors DoubleZip Wallet Wristlet Phone Case Cider Multi
          
      NWT",82.0
Calvin Klein Crossbody,28.0
Burberry bags,420.0
"Badgley Mischka Blush Quilted Chain Crossbody Bag
          
      NWT",60.0
"#578- VB- Clear Case with Navy Trim
          
      NWT",20.0
"Auth Louis Vuitton 3 piece epi  Purse, wallet, key case. Also listed separate",2475.0
"Stella McCartney Mini Crossbody Metallic Pink
          
      NWT",800.0
"Mejuri Set
          
      NWT",10.0
Vintage Coach Mahogany Crescent Shoulder Bag  Tanned Leather G25-7592,139.0
Kate Spade “NO VACANCY” Vegas Icons Rawley Novelty Bag,225.0
Like Dreams NWOT Small Poppy Bowtie Straw Crossbody Bag,48.0
"Constance Mini 18 Mysore Goatskin Gris Perle
          
      NWT",14999.0
LOUIS VUITTON Brown Monogram Leather Keepall 55 Boston Bag,1460.0
"Karl Lagerfeld NWT Maybelle Satchel
          
      NWT",149.0
NEW YORKER brown split genuine cowhide marbled  leather wallet vintage 70s RaRe,18.0
"MICHAEL KORS Maisie Medium Pebbled Leather 2-in-1 Backpack CARNATION COL…
          
      NWT",162.0
Joy Iman Shoulder Bag Clutch Convertible Envelope Style‎ Black Leather,20.0
Vera Wang White Leather Shoulder Bag,20.0
Brighton Heart Love Pattern Fanny Pack NWT Belt Bag by Brighton,39.0
Dooney Tote,150.0
Dooney & Bourke North South Janine Pebble Grain Crossbody EUC,88.0
Vintage Walt Disney World Mickey Mouse Green Blue Plaid Mini Backpack,50.0
Coach vintage black bag. Nr C33-9592,105.0
- Gucci GG Marmont Round Black Leather. Excellent Condition.,1250.0
COACH Shoulder Bag 12406 Black/White Bleeker Hobo Crossbody Leather (was white),88.0
"NWT Victoria's Secret Straw Bucket-Style Tote Bag in blue and tan color
          
      NWT",25.0
Stella Collections Beautiful Handmade Wicker Clutch,45.0
Wisconsin Badgers‎ Curve Zip Organizer Ladies Wristlet Wallet NCAA,12.0
"Roberto Cavalli bag
          
      NWT",660.0
Great nwot burlap Royal Caribbean tote bag,20.0
"BABES Tote bag
          
      NWT",45.0
Ori Black Round Crossbody Bag,40.0
"Dark Raspberry Jet Set Travel Large Saffiano Leather Tote Bag
          
      NWT",299.0
Black and Gold Crossbody Bagl thank you all for the LOVE NOTES,999.0
"Moschino Logo Snakeskin Print Leather Shoulder Bag - NWT
          
      NWT",750.0
Michael Kors Python Snakeskin Embossed Genuine Leather Berkeley Clutch Bag Purse,60.0
COACH Small Corner Zip Wristlet,25.0
"Nicole by Nicole Miller ""Cassidy"" maroon faux leather crossbody bag - NWT
          
      NWT",18.0
Valentino Garavani Satin Brown Shoulder Bag with Gold Chain,299.0
Sézane Bonjour Phoenix Amour Tour From Paris Canvas Tote Bag Excellent Cond,28.0
Maruca | Vibrant Orange and Green Floral Shoulder Bag,25.0
Lizzie Fortunato Hand embroidered Otami embroidered clutch,80.0
"Elegant Floral Embossed‎ Cosmetic Bag Makeup Organizer Travel Toiletry Bag NWT
          
      NWT",13.0
Edward Harvey Black Leather Wallet,28.0
Charlie Lapson Beige Tan Crocodile Embossed Leather Purse,50.0
Vintage Genuine Leather Shoulder Tote Bag Brown 16x12 Made in Mexico,17.0
Whiting and Davis International Vintage Liquid Silver Crinkle Evening Bag Purse,69.0
Coach Vintage Mini Bag Pale Pink with Apple Green Interior Black Leather Accents,100.0
"NWT Kate Spade bag.
          
      NWT",150.0
Authentic Aquatalia Leather Tote Black Medium,68.0
Universal Thread Double Gusset Crossbody Bag,15.0
"Coquette Colorblock Pink Love Wings Mini Backpack - NWT
          
      NWT",40.0
Vera Bradley Wildwood Wallet Crossbody in Purple Rhapsody Premium Cotton NWOT,64.0
"NEW Hello Kitty Teal & Pink Wallet with Tassel
          
      NWT",12.0
Chanel Patent Leather Round CC Handle Bag Black,7380.0
"Ted Baker Tweed Box Bag - Burgundy trim/ Sophisticated Crossbody (NWT)
          
      NWT",119.0
Zyia Inspiration 17 Liter Trekking Pack,30.0
"NEW Juicy Couture Black Heartless Slim‎ Elongated Bifold Wallet
          
      NWT",30.0
Relic Brown Embossed Leather Trifold Wallet With Checkbook Insert.,30.0
"NWT Rains Waterproof Backpack Mini W3 In Color Waves Blue
          
      NWT",45.0
Kate Spade Bleecker Large Black Tote | Good Used Condition,56.0
Bensimon Collection Taupe Tan Studded Tote Bag,18.0
"MCM Himmel Triangle
Crossbody Bag In Lauretos NWT
          
      NWT",385.0
Anthropologie Colorful Beaded Shoulder Bag,60.0
DOONEY BOURKE Rainbow Monogram Coated Canvas with Rainbow Zipper Mini Bag,350.0
Commense Black Bucket Bag Hobo‎ Y2K Handbag,16.0
VTG Fossil Pebble Leather Black Messenger Crossbody Shoulder Purse Bag,51.0
"NEW!  Boho Vintage Style Crossbody Bag – Chic, Lightweight & Trending
          
      NWT",27.0
"Fossil Small Card/ID Holder, Vintage Croc-Embossed Leather",15.0
"New COACH Teri 2way Shoulder Bag Crossbody Straw/Leather Latte
          
      NWT",125.0
💯 Authentic Louis Vuitton Agenda 🍀,299.0
Fossil crossbody bag white with dots,18.0
"Kate Spade Oh Snap Mini Camera Bag Dark Raspberry Multi KJ054
          
      NWT",109.0
"Made in India ""Apres Ski"" Wristlet - Red and White - Large - Beaded
          
      NWT",27.0
👛👛CLEARANCE👛👛Steve Madden Pink Clutch Wristlet with Metallic Detail,18.0
"Retired VERA BRADLEY Cheery Blossoms Wristlet Zip Around Wallet NEW
          
      NWT",21.0
Michael Kors White Leather Saddle Bag,150.0
Melie Bianco Lia Wristlet,20.0
Anne Klein Golden‎ Brown Faux Crocodile-Embossed Crossbody/Shoulder Bag,14.0
"$3 SHOW
          
      NWT",28.0
"Athleta All About Crossbody Belt Bag Blue Black New With Tags
          
      NWT",22.0
"LUG Tip Toe Crossbody NWT - Poppy Red
          
      NWT",50.0
"Christian Louboutin, Paloma Bengali, leather clutch/shoulder bag
          
      NWT",1095.0
"MICHAEL KORS LARGE DOUBLE ZIP WRISTLET PHONEHOLDER WALLET CLUTCH 
BLACK SIGNATUR",87.0
Lot of 5 Lululemon Reuseable Shopper Tote Lunch Gift Bags Variety of Sizes,18.0
"Vintage two birds purse, hand woven wool crossbody bag",40.0
Y2K‎ Brown Faux Leather Fur Trimmed Shoulder Bag Tote Purse Hobo Preppy Bratz,25.0
HOBO Lauren Double Snap Clutch in Raspberry,78.0
Louis Vuitton Brown Monogram Card Holder,238.0
Hobo Wristlet Wallet Nova Retractable Strap Leather,50.0
Rare VINTAGE CHANEL Lamb Skin elegant Small Tan Quilted Cross Body 1980S,1100.0
Bettlejuice Women's Unbranded Jewelry Box Small White Beige,20.0
RALPH LAUREN Tartan Plaid Laptop Briefcase Crossbody Messenger Bag RARE,950.0
River Island Black Quilted Shoulder Bag with Gold Chain,15.0
💎✨Authentic Louis Vuitton Monogram Odeon PM Crossbody Bag,1798.0
"💕Lululemon All Night Festival Bag 5L - Black w/ Gold Hardware Crossbody Sling
          
      NWT",56.0
"Women bag ​
          
      NWT",15.0
Chanel Coco Button Bifold Wallet,577.0
Metropack messenger bag,12.0
"Solo perche Siena Turquoise and Tan Crossbody Bag brand new
          
      NWT",90.0
Wild Fable | Scrunch Handle Bag,13.0
"Mini Coin Purse TikTok Lipstick Kiss Clasp Puppy Butterfly Print Small Bag
          
      NWT",10.0
Green Tote Bag,250.0
"Loungefly Disney Princess Icon Wallet
          
      NWT",35.0
Francesco biasia brown wicker wristlet,201.0
"Valentine’s Day heart sequin‎ reusable shopping tote bag cotton eco friendly new
          
      NWT",17.0
Gloria Astor Vintage Woven Clutch,25.0
"‘More Issues than Vogue’ Stylish Wristlet Clutch
          
      NWT",25.0
Vineyard Vines Ivy League Zippered Canvas Tote Bag - Cream and Navy,20.0
Charming Charlie RSVP faux pearls and rhinestones purse,40.0
Vintage Coach Y2K Denim Blue Tie-Dye Signature Hobo,175.0
"Louis Vuitton Mini Pochette Accessoires
          
      NWT",1050.0
Ipsy Glam Makeup Bag | Red Lips 💋,10.0
Authentic Dior Black Bag with Gold Chain Accent,850.0
LO & SONS CATALINA DELUXE TOTE LARGE IN DOVE GREY,53.0
Nylon Brown Handbag,40.0
Black handwoven sisal bag/ kiondo bag/kiondoo bag/ sisal tote bag/ handmade bag,66.0
"Nicole Miller classic‎ preppy minimalist gold metallic purse handbag NWT
          
      NWT",31.0
Sharif Gold Textured Clutch,45.0
"Calvin Klein Hailey Convertible Crossbody Bag​​​​​​​​​​​​​​​​​​​​​​
          
      NWT",69.0
Gucci GG Marmont Small Quilted Leather Camera Bag Ivory White Crossbody,1150.0
Sondra Roberts Squared Boho Fringe Bucket Bag,34.0
Champion Red Waist Bag Fanny Pack‎,22.0
Coach nude beige double handle shoulder bag,69.0
Coach Teal Blue Green Suede Shoulder Bag,65.0
Vintage Tote Bag Mod Neutral Beige Sand Unisex,47.0
Kate‎ Spade Messenger Laptop Bag,40.0
Marc Jacobs Limited Edition Party Bow Mini Trouble Bag 2015 resort collection,450.0
MCM Viseto 35cm Black Messenger Saddle Bag. EUC❗️with COA.,450.0
Ugg Bucket Style Bag,128.0
"Tan Crossbody Bag
          
      NWT",39.0
O'Neill Mini Backpack Black White Hickory Stripe Canvas Butterfly Patch Skate,24.0
Coach Floral Pink and Yellow Wristlet,60.0
"Madden NYC, by Steve Madden, NWT, silver puffer mini cargo backpack.
          
      NWT",30.0
Island Aloha Wear Reversible Tote Made in Hawaii Like New!,30.0
CELINE Yellow Suede Macadam and Leather Monogram Hand Bag,380.0
Etro Milano Brown Leather Portfolio Briefcase,80.0
"Michael Kors Jet Set Travel Lg Double-Zip Wristlet-Wallet-PhoneHolder Ox…
          
      NWT",86.0
Coach A06S-0498 Small Optic Signature C Metallic Leather Shoulder Bag Tote Purse,60.0
Coach Black and Gray Signature Hobo Bag,90.0
Vera Bradley Purple Women's Bag,25.0
"Kate Spade Ella Dottie Lady Bug Large Embroidered Tote
          
      NWT",160.0
Brighton Black Leather Crossbody Embroidered Multiple‎ Pockets Strap,50.0
"NWTs Yak & Yeti Blue Tree Nature Canvas Shoulder Bag Adjustable Strap
          
      NWT",15.0
Athleta All About CrossBody Muted Teal,16.0
Chumbak Carnival Tent Embroidered Foldover Clutch Purse,20.0
"SAMARA Pink Peony Vegan Leather Medium Shoulder
Crossbody Bag Purse",35.0
Lily Bloom Gracia Convertible Bag Butterfly Crossbody Shoulder Bag Recycled,25.0
"Patricia Nash Passport Wallet Travel Organizer Floral Burgundy Red Leather
          
      NWT",44.0
Free People Movement Puffer Sling Sport Tote Messenger Bag,68.0
Michael Kors Jetsetter Crossbody,50.0
Badgley Mischka Patent Leather Tote Emerald Green Shoulder Bag Silver Hardware,49.0
French West Indies Bag,45.0
Vera Bradley Plum Crazy Colorful Patterned Women's Bag and Wallet Set,53.0
"Coach Ashley Black Leather Shoulder Bag, With Crossbody Strap",70.0
"Lilly Pulitzer for Estee‎ Lauder Pink Floral Makeup Cosmetic Bag
          
      NWT",12.0
Like New Coach Hampton Pastel Striped Handbag Tote Purse,225.0
Authentic CHANEL Lambskin Matelasse wallet on chain crossbody bag,1250.0
"Anthropologie Bali Cellphone Crossbody Bag,100% Rattan,Linen 100% Cotton",45.0
COACH Navy Envelope Wallet EUC,64.0
"VINTAGE Newton Beach/Market Bag; Beachcore, Boho, Canvas, versatile mult-iuse",13.0
"VICTORIA'S SECRET VSX SPORT FOLDABLE WORKOUT TOTE BAG,BLACK/PINK LIGHTWEIGHT NEW
          
      NWT",22.0
"Stoney Clover x Target White Terry Cloth Tote Bag Embossed Logo Beach Bag NEW
          
      NWT",41.0
"BATH AND BODY WORKS boho dark wash denim Cosmetic case with mirror set
          
      NWT",24.0
"NWT- Rare Disneyland Snowman Christmas Holiday Tote Bag
          
      NWT",56.0
"Kate Spade Cameron Convertible Crossbody Brand new !
          
      NWT",145.0
"Various Fringe Crossbody Bag – Yellow, Size One Size – Good Condition",40.0
Kate Spade Tilia Crossbody (Gray),65.0
"Thirty One Timeless Wristlet -‎ patchwork paisley
          
      NWT",16.0
"NWT Handwoven Round Rattan Crossbody Bag Bali Boho Beach Festival Leather Strap
          
      NWT",50.0
"RF ID zip front Mickey and friends wristlet​
          
      NWT",32.0
"Free People Say Yes Bag
          
      NWT",60.0
"Kate Spade Lucy Medium Wristlet Black Pebbled Leather NWT
          
      NWT",95.0
Roller Rabbit Multicolor Beaded Clutch,26.0
Boho embroidered saddle bag with beaded tassels. Excellent condition!,150.0
Celine‎ Macadam Boston Bag Satchel Handbag Designer Purse Small,316.0
"Calvin Klein Signature Two Tones Large Wristlet/Clutch, like New.",30.0
"VALENTINO BY MARIO VALENTINO Grace Logo Leather Shoulder Bag - Peach Blush - NWT
          
      NWT",239.0
Bob Mackie Rodeo Drive Croc Print Leather Satchel Handbag,79.0
RALPH LAUREN Brown Green Tartan Plaid Crossbody Messenger Laptop Briefcase Bag,950.0
"MICHAEL KORS- BEDFORD MD PKT Tote Bag Mini MK Logo in Vanilla/LUGG
          
      NWT",140.0
"Florence Griswold Museum Tote‎ Hand Bag Old Lyme, CT Beach Bag w/ Zipper",17.0
"Conserve Recycled Material Stripe Shoulder Bag
          
      NWT",15.0
Vera Bradley Wallet,23.0
"Louis Vuitton #315
Lock and Key W/ Gold Chain",70.0
"New Lole Ivory Handwarmer Belt Bag, crossbody purse
          
      NWT",12.0
"Waterproof Beer Corgi Medium Snap Fold Wallet Purse Coin Pouch
          
      NWT",32.0
