,listing,price
0,Vintage Coach Purse,140.0
1,Coach Hallie Shoulder Bag In Signature Canvas,119.0
2,Lagoo leather mint green Hobo Bag with gold hardware,46.0
3,Jessica Moore Quilted Backpack Cloud Creme NWT,40.0
4,"Harley Davidson black leather handbag purse NWT embossed‎ logo small
          
      NWT",95.0
5,JUTE BERMUDA SUMMER HANDBAG WITH EMBROIDERY,40.0
6,Michael Kors Light Blue Gilly Large Drawstring Travel Tote,100.0
7,Nicole Lee Elegant Black and Silver Women's Handbag faux stone front,36.0
8,Lucky Brand Crossbody Bag in Cream Colored Leather with Hobo Like Silhouette,39.0
9,"Tory Sport Reusable Nylon Sport Bag, Great for Pickleball Paddles/Balls",13.0
10,GUCCI Vintage Micro GG Canvas Shoulder Bag PVC Leather Beige,295.0
11,Hello Kitty X Arnold Palmer Crossbody Mini Backpack - Very RARE Limited Edition,625.0
12,Christian Louboutin Louis Tote Bag Navy Denim Rubber Leather,1099.0
13,Genuine Leather mini crossbody,25.0
14,"Steve Madden Womens Bpauli Handbag
          
      NWT",100.0
15,"Festive‎ AF Christmas NEW tan tote bag
          
      NWT",20.0
16,💰Vera Bradley ALPINE CHECK Zip ID Case RETIRED Blue & Black Checkered💰,8.0
17,🤎 Patricia Nash Leather Tassel Crossbody Bag – Brown,68.0
18,GUESS Women's Floral Wallet,65.0
19,"Leather Flower Purse Charm Genuine Leather Red Poinsettia Flower Bag Charm NEW
          
      NWT",32.0
20,Prada Canapa Blue Denim Tote with Structured Design,650.0
21,"LILLY PULITZER Zip Top Wallet
""Party Like A Lobster"" Wristlet
Wallet",16.0
22,"korilakkuma flat pouch with zipper
          
      NWT",22.0
23,"Disney Minnie Mouse Red Stripe Wristlet Wallet NWT
          
      NWT",18.0
24,Timeless Multicolor Tweed Cottage Bucket Bag,30.0
25,Kate Spade Elegant Black Tote with Bow Accent,60.0
26,💯Authentic Bally Handbag🍀,299.0
27,"Auth Louis Vuitton Monogram
Deauville Handbag W/DBag",1350.0
28,SHIRALEAH small bag red flower floral snap closure inside zipper pocket,29.0
29,Classic Box Bag with Adjustable Strap,25.0
30,Coach Black Crossbody Bag,40.0
31,LOUIS VUITTON Amazon Monogram MM Crossbody Shoulder Bag Adjust Strap LV DUST BAG,1850.0
32,Loungefly Harry Potter Luna Lovegood Print Mini Backpack,65.0
33,Bougainvillea Beaded Mini Crossbody Bag Gold Paisley Evening Pouch,24.0
34,"RARE HP ballerina telfar bag
          
      NWT",385.0
35,Disney Mickie Mouse Mini Backpack Black & Red by Bioworld 7.5”x8.5”,20.0
36,Kate Spade Animal Print Wristlet leopard large wallet like new,65.0
37,Gently Used B. Makowsky Black Leather Shoulder Bag,45.0
38,Like New Rare Coach Dotted OP Art Purple Ashley Shoulder Bag Purse,250.0
39,"Juicy Couture Double Zip Bag
          
      NWT",95.0
40,"Le’Miel Quilted Charmed Crossbody (NWT)
          
      NWT",35.0
41,"Valentino Orlandi Black Bag with Gold Accents
          
      NWT",78.0
42,HOBO INTERNATIONAL Black Patent Envelope Clutch‎ Magnetic Fold Flap Purse,30.0
43,Vintage Coach Tribecca Leather Shoulder Tote No. 9098 Made In Costa Rica,125.0
44,"DIOR Pink Mini Bucket Bag with Drawstring Closure, New!",49.0
45,Diane Von Furstenberg Black Beaded evening Clutch,45.0
46,"HOT! Betsey Johnson Unicorn lunch tote!
          
      NWT",55.0
47,Coach Hampton Floral Appliqué Woven Tote Bag Style 15029 – Yellow & Gold,150.0
48,Vintage Needlepoint Portrait Purse Lee’s Needle Art Handstitched Shoulder Bag,65.0
49,Misty Harbor Quilted Shoulder Bag,12.0
50,MZ Wallace Mini Sutton Paint Splatter Crossbody,135.0
51,💯Authentic Gucci Dionysus shoulder bag in the GG Supreme🍀,1399.0
52,"Vera Bradley Bronze color Tote Bag - neutral Classic, for everyday or travel Y2K",13.0
53,ANASTASIA Beverly Hills we are brows black canvas tote bag brows on point always,12.0
54,"🌹Rowing Blazers X Target l NWT Rose Print‎ Belt Bag
          
      NWT",24.0
55,Michael Kors Black and Gold Leather Shoulder Bag,50.0
56,Liz Claiborne Red Small Crosbody‎ Women's,18.0
57,"✅Coach Gallery Tote With Heart Print
          
      NWT",239.0
58,Patricia Nash Discovery Woven Leather Rometta Satchel Ivory Off White,100.0
59,Stone Mountain Genuine Leather Tan Shoulder Bag Organizer Pockets,68.0
60,Kate Spade Scarlet Wristlet,35.0
61,"Tommy Bahama Isle Of Palms Hobo Bag Purse Leather & Tapestry Palm Trees NWT
          
      NWT",50.0
62,Chanel Pastel Shoulder Bag with Gold Accents,420.0
63,"Universal‎ threads NWT clutch.
          
      NWT",6.0
64,"🤩 SHOW FREEBIES!!!! 🌟
          
      NWT",60.0
65,Juicy Couture OverSized Tote Bag,45.0
66,Michael Kors Pebble Leather Tassel Hobo Shoulder Bag Tan Gold MK Logo,99.0
67,Sanrio Kuroni wallet,30.0
68,VTG COACH LIGHT GOLD GENUINE LEATHER SHOULDER BAG HANDBAG PURSE TOTE SATCHEL,60.0
69,V. Valentino Mini Top Handle Bag,175.0
70,Rampage Black and Red Floral Wallet,18.0
71,"Vintage leather crossbody
          
      NWT",45.0
72,A New Day Olive Green Nylon Fanny Pack Belt Bag Adjustable Strap Gold Zippers,11.0
73,Botkier Ivory Leroy Embossed Anaconda Satchel Size 15” x 6.25” x 8.25”. #M-0925,55.0
74,"NWT Black Yankee Candle Shoulder Bag/Purse
          
      NWT",20.0
75,Sole Society tan bag,40.0
76,9” x 14” Christian Louboutin Soft Dust Bag Dustbag,29.0
77,"UGG’s Nasha Bags
          
      NWT",47.0
78,Michael Kors Charcoal Signature Tote,81.0
79,Yves Saint Laurent white wallet on chain with silver hardware,1399.0
80,"Vera Bradley RFID Wallet Crossbody Carbon Grey New
          
      NWT",49.0
81,"VENTO MAREA Luxury Handbag Tote PU Leather  Crossbody Bag shoulder
          
      NWT",16.0
82,"NWT Juicy Couture Retro Vibe Shoulder Bag in Chocolate/Dusty Blush (Pink/Brown)
          
      NWT",36.0
83,"Handcrafted Machine Quilted Floral Shoulder Bag, Purple and Green",15.0
84,Buxton Wristlet Wallet Fits Smartphone Cash Cards Keys Change,22.0
85,"Disney Mickey Mouse Marathon Weekend lug Bag
          
      NWT",60.0
86,🖤 Louis Vuitton Black Shoulder Bag 🖤,498.0
87,Lululemon DTB Duffel Black-RARE,98.0
88,Unlisted item,99.0
89,"JUICY COUTURE Bestseller Fame Satchel Bag In Cafe
          
      NWT",65.0
90,The Sak Crochet Mini Crossbody Purse Black,15.0
91,Sakroots,29.0
92,America & Beyond Caribbean Vacay Beaded Tote Bag.,70.0
93,GUC Tignanello Leather/Suede Colorful Patchwork Slouchy Hobo Handbag Y2K,21.0
94,"NEW CELINE SMALL CABAS THAI TOTE CROSSBODY BAG
          
      NWT",1699.0
95,"MK Leather Card Case, NWOT",20.0
96,Gucci Blue Diamante Medium Catherine Dome Handle two way Women's Bag with wallet,425.0
97,Frye Leather Backpack – Cognac Brown,119.0
98,"Straw Woven Tote Bag Shoulder Bag Shopping Bag Beach Bag‎ Beige
          
      NWT",30.0
99,Anthropologie Shiraleah Arden Wristlet,19.0
100,Nine West Bag crossbody wrislet,29.0
101,Louis Vuitton Monogram Trousse Toilette 28,499.0
102,"Lululemon All Night Bag 2L Black Lightweight Adjustable Crossbody Pack
          
      NWT",48.0
103,Vilenca Holland Brown Woven Shoulder Bag,65.0
104,Coach Black Signature Silver Chain ShoulderBag Adjustable Strap,66.0
105,Athleta Ombré Blue Tote Bag,20.0
106,Coach Y2K Hamptons Mini Canvas Summer Tote Bag With Lady Bug Charm EUC No. 5659,158.0
107,"🩷🎃NWOT-MAD ENGINE ADORABLE PINK PUMPKIN CROSSBODY 🩷🎃
          
      NWT",48.0
108,"Michael Kors Jet Set Large Pink Wristlet
          
      NWT",85.0
109,Saks Fifth Avenue black croc embossed leather vintage jewelry case rare,199.0
110,"Woman’s woven handbag
          
      NWT",38.0
111,"REBECCA MINKOFF, black Leather Crossbody Bag. 5 Zipper.",57.0
112,Coach Pebbled NAVY Leather Tote With Crossbody Strap,110.0
113,❤️❤️KURT GEIGER Shoulder Handbag Red Black Fabric Woven Fringe Gold Chain Strap,175.0
114,"Sak Saum For Abi Ferrin  For Freedom Clutch NWT
          
      NWT",38.0
115,MARC by Marc Jacob’s Classic Q Isabelle Crossbody Bag,65.0
116,Vintage Brown Leather Gucci Shoulder Bag,99.0
117,Vera Bradley Quilted Tote Bag,50.0
118,DKNY Quilted Shoulder Bag in Soft Cream,45.0
119,Vintage Dooney & Bourke Baguette Bag​​​​​,60.0
120,Kate Spade Bag Purse Handbag Leather Large Shopper Tote Black Pocketbook,100.0
121,Free People Mesh Floral Bag,10.0
122,New Handmade Buntal Straw Clutch Purse Chain Strap Magnetic Snap Closure Tan,46.0
123,"Juicy Couture Beige Satchel bag with crossbody strap
          
      NWT",62.0
124,Pretty Little Thing Satchel Crossbody - Black - Puffy Faux Leather Woven NWOT,25.0
125,"Antik Kraft | Floral Jute Straw Tote Bag
          
      NWT",64.0
126,Balenciaga Cabas Small Canvas Tote Bag Navy,2849.0
127,Kara light blue leather mini bag,250.0
128,Neiman Marcus Navy Perforated Tote Bag leather,25.0
129,"NWT Kate Spade Vibrant Black/White Neda Wallet
          
      NWT",118.0
130,"VERA Pelle,Genuine Leather‎ Navy Blue/Brown,Shoulder Bag",39.0
131,"Animal Spotted Fanny pack Waterproof new with tags pink
          
      NWT",20.0
132,"Stone Mountain Capri Leather Bag
          
      NWT",74.0
133,Vintage Embroidered Victorian Floral Chain Tapestry Handbag Small Purse Regency,59.0
134,Authentic Gucci Vintage Bamboo Drawstring Shoulder Bag Nylon Leather Dark Brown,225.0
135,"omen's Vegan Leather Convertible Tote Handbag, Stylish Round Handles, Large
          
      NWT",18.0
136,"Kate Spade Staci Lily Bloom Floral Print 3fer - Wristlet, Coin Pouch & Card Hold",117.0
137,Nine West Faux Gray Snakeskin bag handbag crossbody purse,15.0
138,Maggi B Quilted Tote Bag Boho Floral Paisley Red Gold Shoulder Bag Pattern 💵,14.0
139,Coach Mini Signature Black Wristlet Early 2000s Y2K,40.0
140,Paisley Patterned Tote Bag - Multicolor,28.0
141,Louis Vuitton Portefeuille Sarah Long Wallet,269.0
142,Baby Phat Patterned Clutch with Black Trim✨,28.0
143,Disney Anna Olaf Frozen Crossbody Bag,25.0
144,Furla Classic Trifold Wallet Saffiano Two Tone Leather • Vintage • Beautiful,63.0
145,"COPY - Authentic Prada dust bag 9X13.
          
      Boutique",25.0
146,Vintage Red Burberry's Card Holder- EUC,150.0
147,Valentina Orange Pebble Leather Backpack w/ Brown straps Bag Purse Made In Italy,65.0
148,Escort vintage frame bag,128.0
149,Victoria's Secret glitter drawstring silver backpack like new,44.0
150,Pixie Mood Vegan Leather Clutch / Cosmetics Pouch – Camel/Tan,14.0
151,"ALDO Geometric Satchel - Brown and Cream
          
      NWT",45.0
152,Kavu Travel Small Duffel Bag•Blue•RV Sail Boat Glider •Used* Read,25.0
153,"Coach Rainbow Roller Skate Print Graphic Canvas Tote Bag Limited Edition New!
          
      NWT",289.0
154,Carla Marchi messenger bag great condition,62.0
155,Crochet Hobo Crossbody Bag Purse Green Zipper Crochet Straps,13.0
156,Adidas Sackpack Drawstring‎ Retro Style Colorful Gym Cinched Backpack Storage,14.0
157,"Trader Joe's Blue and Cream Canvas Tote
          
      NWT",20.0
158,"NWT Brahmin esme coral snapdragon 
Floral Pink Shoulder Bag
          
      NWT",325.0
159,Kate Spade Green Polka Dot Daycation Bon Shopper Tote,48.0
160,Vintage Louis Vuitton Tricolor Noe in Red Castillian Epi Leather,376.0
161,"Badgley Mischka Sequin Black Women's Bag
          
      NWT",65.0
162,American Leather Shoulder Bag - Olive,49.0
163,"JU JU BE Mighty Bag. Waterproof Teflon
          
      Boutique",35.0
164,"🌼Michael Kors Purse
          
      NWT",219.0
165,"Frye Women’s Leather Belt Bag Dark Brown Small Medium Waist Pack
          
      NWT",75.0
166,Louis Vuitton Monogram Envelope Carte De Vistie FULL INCLUSION,399.0
167,Guess G logo snakeskin raffia shoulder purse travel bag Y2K Bratz Grunge 90s,20.0
168,Dior Beige Vintage Honeycomb Canvas Chain Crossbody Bag,650.0
169,"Kate spade Madison Large Slim Bifold Wallet (tutu pink)
          
      NWT",89.0
170,Coach Madison Metallic Gesso Op Art Tote,199.0
171,"Juicy Couture NWT pink barrel shoulder purse logo sparkle detail
          
      NWT",52.0
172,Gucci Pelham Vintage Shoulder Bag With Gold Tone Hardware & Braided Handles EUC,499.0
173,"Kipling Crossbody Metallic Gold Bag Adjustable Strap 6x8""",28.0
174,Abera Convertible Backpack - Able,160.0
175,"DOONEY & BOURKE , Ostrich Hobo.",178.0
176,KATE SPADE NEW YORK Saffiano Leather Handle Bag,90.0
177,Bohemian Navy Tie-Dye Crossbody Bag,40.0
178,"Coach CJ672 STANTON CROSSBODY WITH HOUNDSTOOTH PRINT
          
      NWT",165.0
179,"Victorias Secret Black Bag with Tiger Print Clutch
          
      NWT",40.0
180,Jen & Co. Cleo Vegan Coin Pouch Purse with Chain Strap Light Gray,15.0
181,Adrienne Vittadini Women's Card Case Wallet Burgundy Embossed Fleur De Lis NWT,25.0
182,Vintage CRAZY HORSE Leather Crossbody Brown Shoulder Bag Please Read,36.0
183,LOUIS VUITTON EPI LEATHER WALLET,128.0
184,Bijoux Terner Elegant Black Evening Clutch Purse Silver Chain Strap‎ Formal,26.0
185,"Viral Beaded Velvet Handbag
          
      NWT",75.0
186,Rich Brown Leather Tote,45.0
187,Coach Vintage Small Duffle Sac,189.0
188,Brown Patchwork Leather Shoulder Bag,15.0
189,Etienne Aigner Small Purse,30.0
190,New York &‎ Company Crocodile-Embossed  Tote,22.0
191,"Versace 1010951 Crocodile-Embossed Black Leather Mini Bag
          
      NWT",700.0
192,Kate Spade Shoulder Bag,55.0
193,Dana Buchman Tropical Floral Satchel/Crossbody – White Multicolor,29.0
194,PIXIE‎ MOOD Tote Bag Peach Leather Scalloped Top Snap Closure,18.0
195,"Marzo In Leather Vintage Never Used Black Leather Crossbody Bag Purse Ostrich
          
      NWT",76.0
196,Z Spoke Zac Posen,75.0
197,Coach Kristen Heather Hobo Satchel Leather Convertible Shoulder Crossbody Gray,65.0
198,"MARC JACOBS DAISY MEDIUM TOTE BAG NWT
          
      NWT",45.0
199,Lug Skipper Shoulder Pouch In Fog Gray Crossbody Bag‎,22.0
200,Charles David Brown Leather Croc Embossed Tassel Braided Shoulder Bag,38.0
201,Calvin Klein Dark Brown Monogram Tote,56.0
202,"Ed Hardy set of 2 Cosmetic Makeup Bags
          
      NWT",45.0
203,MICHAEL Michael Kors Brown Signature Coated Leather Jet Set East West Tote,38.0
204,Margot Black Soft Leather Crossbody Bag Nylon Strap Grunge Classic Punk,38.0
205,Madewell Black Leather Lorimer‎ Mini Backpack Classic Minimalist Chic Indie,70.0
206,Victoria’s Secret black vinyl handbag or shoulder bag,20.0
207,Whiting & Davis Gold Mesh Evening Bag Chain Strap,40.0
208,Kate Spade New York Thomas Classic Noel Crossbody Bag Black Beige Patent Leather,44.0
209,Michael Kors Signature Lydia Large‎ Shoulder Hobo Bag in Natural/Acorn Authentic,125.0
210,Chanel Black Quilted Crossbody with Gold Chain,388.0
211,Vintage Black Glass Beaded Clamshell Shoulder Bag With Long Strap Elegant,26.0
212,"🔥""Lululemon All Night Festival Bag 1L - Black Crossbody, Like New, NWOT""
          
      NWT",49.0
213,Coach Dakotah 34397 Cream Leather Shoulder Bag,250.0
214,Stylish Paisley Crossbody Bag 💗,13.0
215,Chanel Black Caviar Leather Wallet- Great Used Condition,350.0
216,Kate Spade New York Schuyler Medium Toe and Wallet PocketbookBeige/Tan Leather,130.0
217,"New Season Chloé large Carry Canvas Leather tote bag in Neutral Beige ~NWT~
          
      NWT",1250.0
218,American Leather Co Jamestown light brown leather tote,55.0
219,Loungefly Disney Cruise Line Donald Duck Sailor Wallet,45.0
220,"Women Mini Vegan Leather Print Monogram Crossbody Bag
          
      NWT",32.0
221,All Saints Evaline Black Croc-Embossed Leather Crossbody Bag with Dust Bag,100.0
222,"Glossy Black Crescent Hobo Bag
          
      NWT",10.0
223,NEW MARNI Tropicalia small Tote bag in green,339.0
224,Chanel Classic Flap Medium,499.0
225,"NWT Juicy Couture Black Velour Wingin' It Tote & Heart Pouch - Y2K
          
      NWT",100.0
226,Lilly Pulitzer Cute Lunch Bag for Women Large Capacity Insulated Tote Bag,33.0
227,"Japanese Pink Clutch with Embroidery NIB
          
      NWT",10.0
228,Mermaid Sequin Backpack,28.0
229,"Coach Hailey Flap Bag Shoulder/Crossbody In Leather/Silver/Black CAN72 NWT
          
      NWT",169.0
230,Vintage 1950s LODIS Womens Ultra Soft Black Leather Kisslock Wallet Clutch Spain,39.0
231,Talbots Long Sleeve Women's Shirt Blue & White Striped Sz Xl,6.0
232,IPSY Cosmetic Pink Mauve Glam bag,6.0
233,Patricia Nash Black‎ & Tan Tuareg Woven Ava Medium Leather Crossbody Tote,140.0
234,White Bottega Veneta Fringe Cassette Bag,1550.0
235,Kate Spade Green Polka Dot Daycation Bon Shopper Tote,48.0
236,Vintage COACH Lennox Bag Navy Leather Crossbody RARE 9918,448.0
237,Vintage Patricia Nash Praga Flap Genuine Red Leather Crossbody Bag Purse,53.0
238,"Y2K Coach Signature Heritage Stripe Tote Bag Brown Pink Monogram
 F13548 Logo",50.0
239,Betsey Johnson Handbag Satchel Black Embossed Hearts and Floral Lining,56.0
