,listing,brand,price
0,PRADA - Black Nylon Leather Tote Bag,,843.0
1,Vintage Coach Black Hippie Flap Saddle Crossbody Bag 9134,,150.0
2,Lululemon Everywhere Belt Bag Crossbody - Color Silver Drop NWOT,,49.0
3,Free People Canvas Vegan Leather Tote Bag,,30.0
4,KATE SPADE Layton Wellesley Zip Wallet Wristlet Moussfrost‎ Beige Old Money,,26.0
5,Gucci Horsebit 1955 Small Shoulder Bag,,499.0
6,"Laurel Burch‎ Cats Butterfly Canvas Tote Bag Weekender Large Charm Artsy 15x5x9""",,40.0
7,Vintage IMAN Leather Crossbody Bag Burgundy and Gold,,50.0
8,Guess Golden Clutch,,13.0
9,Hobo Fern Convertible Backpack Black/Gold Stars Leather,,120.0
10,Must de Cartier Wallet (coin purse),,109.0
11,EDDIE BAUER Large Diaper Shoulder Bag (Adjustable Strap) - Brown/Beige,,18.0
12,Dolce & Gabbana Artistic Splatter Wallet,,399.0
13,Nena & Co Tan Leather Embroidered Shoulder Purse Strap for Handbag,,100.0
14,"Expressions NYC Handbag Teal Vegan Small Makeup Bag Crossbody Strap
          
      NWT",,12.0
15,"PINK Victoria's Secret Cream and Green Travel Bag
          
      NWT",,30.0
16,"Fossil Emma Tote Bag - Cream, Gray, Brown and Black",,40.0
17,Authentic Prada Re-Edition 2005 Nylon Shoulder Bag – Cammeo Beige,,1200.0
18,Balenciaga Crossbody Vintage Bag,,165.0
19,"NWT Trader Joe's Canvas New Halloween  Mini Tote Bag orange and black
          
      NWT",,9.0
20,"Trendy handbag
          
      Boutique",,20.0
21,DKNY Paige Bicolor Leather large Satchel Carryall Purse Donna Karan,,35.0
22,"Michael Kors Jane Large Soft Pink Pebbled Leather Tote Bag
          
      NWT",,169.0
23,Vera Bradley Mini Crossbody Bag,,18.0
24,"Michael Michael Kors Powder Blush Leather Crossbody Jet Set Bag Lg, NWT
          
      NWT",,259.0
25,Kate Spade New York Striped Canvas Tote Pink Orange Cream Shopping Bag,,48.0
26,"AY GUEY Sugar Skull Dia de los Muertos Wristlet Wallet Clutch Floral NWT
          
      NWT",,39.0
27,"Steve Madden Neon Yellow Mini Bag
          
      NWT",,41.0
28,"Michael Kors MK Cooper Logo Sling Pack ADMRL/PLBLUE
          
      NWT",,118.0
29,Juicy Couture Daydreamer Y2K Canvas tote,,287.0
30,Maruca Handmade Tapestry Wristlet Pouch Ikat Woven Boho Clutch Terracotta Rust,,26.0
31,AMERICAN LEATHER CO Triple Entry Leather Auburn 2.0 Crossbody Taupe Tan Satchel,,65.0
32,"NWT Daisy Duck canvas tote
          
      Boutique",,20.0
33,Vera Bradley Islan Bloom Retired Tote Purse 17'x12' Teacher School Beach Diapers,,23.0
34,Vera Bradley Sling Backpack Blue Star Medallion,,16.0
35,Disney Parks Dooney & Bourke Sketch Character Drawstring Mini Backpack Logo Used,,148.0
36,Venus Oversize Reversible Women's Tote Bag Black And Gold,,30.0
37,Coach Poppy Patchwork Hippie Shoulder Bag,,155.0
38,Bottega Veneta Woven Leather Wallet,,175.0
39,BCBG MaxAzria Black Lace Pink Satin Clutch,,37.0
40,ZAC Zac Posen Earths Colorblock Leather Tote Camel,,139.0
41,Black Shoulder Bag (reduced),,58.0
42,Chic Tweed Pearl-Embellished Bag,,12.0
43,Guess Y2K 90's Women's Shoulder Bag Embroidered Vintage,,47.0
44,"Shoulder Bag With Removable 21.5' 9X4.5X2 Silver Thin Chain (Clutch) NWT #1207
          
      NWT",,20.0
45,"NWT Michael Kors Mercer leather crossbody
          
      NWT",,155.0
46,"Ed Hardy Vibrant Pink Skull Embossed Crossbody Bag Wallet with Wristlet NWT
          
      NWT",,49.0
47,Vintage Cole Haan Womens Zip Satchel Brandy Aerin Croco Print Unit Bag Brown,,145.0
48,"Disney Stitch Mini Backpack Bioworld Blue Handbag Purse 11""x9"" Small‎ LILO and",,20.0
49,Dolce Vita leather Shoulder Bag Brown,,30.0
50,Victoria’s Secret Gold & Cream Sequin Canvas Bag Travel Overnight Sexy Chic,,24.0
51,Vintage Treesje Leather Wallet burgundy maroon red zip,,20.0
52,HOBO International Brown Leather Bow Buckle Detail Fold Over Clutch Purse,,50.0
53,Vintage Esprit Leather Trifold Wallet,,21.0
54,Tory Burch Robinson Convertible Shoulder Bag,,199.0
55,Michael Kors Midi  Marina Canvas Shoulder  Handbag Blue Crossbody 8x11,,50.0
56,"JUICY COUTURE Bag Short N Sweet Satchel - Pink
          
      NWT",,65.0
57,Coach F18751 Soho East West Cream & Gold Leather Handbag Purse,,44.0
58,"🆕❤️ Lululemon Everywhere Belt Bag Manifesto Print Red White
          
      NWT",,50.0
59,Adidas Originals Mini Backpack Black Faux Leather Gold Trefoil Logo Small Bag,,57.0
60,Sakroots New Adventure Hobo Artist Circle Crossbody Bag,,30.0
61,"NWT XOXO Crossbody Bag Black White Love Illustration Adjustable Strap Purse
          
      NWT",,29.0
62,"Blue Diamond Lattice Women's One-Shoulder Bucket Bag With Metal Drawstring
          
      NWT",,59.0
63,COACH Poppy Hang Tag Cluster Bag Charm,,145.0
64,Cartier Black Leather Long Wallet with Gold Accent,,389.0
65,Fila Waist Bag Chest Sling,,20.0
66,Compact Nylon Crossbody Bag Multi Compartment Smell Proof Travel Essential,,130.0
67,Brighton Bundle Set,,25.0
68,Ipsy new plaid makeup pouch with a snap closure,,5.0
69,Halloween Ghost Print Tote Bag,,12.0
70,Coach Zip Top Tote in Signature Silver/Black Smoke (F36375),,90.0
71,Prada Bag,,500.0
72,Genuine Coach Mercer 30 Satchel Leather Gray/ Brown Satchel,,64.0
73,"COACH 2 Straps Teri Hobo Bag With Quilting In Velvet/Gunmetal/Burgundy CCW69 NWT
          
      NWT",,248.0
74,"Skagen Ebba Cordovan Backpack
          
      NWT",,198.0
75,Paul Brent Brown and Green Palm Tree Crossbody Bag,,10.0
76,INC International Concepts Fuzzy Purse w/ Charm Coin Purse,,50.0
77,Elegant Blue Woven Clutch,,40.0
78,Louis Vuitton Black and Gold Monogram Crossbody Bag,,388.0
79,Travelon Black Bag Travel Multiples Pockets Zipper for Closure Nylon Crossbody,,37.0
80,"Ed Hardy Black and Red Wallet with Fierce Tiger
          
      NWT",,25.0
81,Chic Red Leather Tote with Brown Handles,,30.0
82,"XOXO Women’s Brown Tan Snap Wallet – Compact 4x3.25-in Fashion Accessory  Brown
          
      NWT",,33.0
83,"Jinammi‎ Purse
          
      NWT",,86.0
84,✨NWOT - Coach Vale Belt Bag ✨,,215.0
85,EUC Zara Half Moon Chain Strap Shoulder Bag,,55.0
86,Michael Kors Whitney Pebbled Leather Tote Pale Blue,,72.0
87,Women's Brown Boho Elephant Handbag Studded Tote Brown Faux Leather,,25.0
88,"STAUD BEADED ZODIAC TOMMY BAG CANCER
          
      NWT",,1500.0
89,Coach Signature Black and Brown Crossbody Bag,,179.0
90,Elegant Euc B Makowsky Black Leather Tote Bag,,75.0
91,CHANEL Black and Gold Shoulder Bag,,5199.0
92,"New PANDORA x Disney Mickey & Minnie Mouse Gold Navy Blue Wristlet Pouch Magical
          
      NWT",,55.0
93,Authentic Louis Vuitton Keepall 50 travel bag green Epi leather unisex,,899.0
94,"Steve Madden Bloodstone/ Burgundy Mini Bag/wallet
          
      NWT",,32.0
95,B. makowski Vintage Purse,,35.0
96,Halston Heritage Oval Crossbody Faux Snakeskin Purse Chain Strap Magnetic,,20.0
97,CELINE Logo 2way Top Handle Shoulder Hand Bag Leather Yellow Italy 89RF903,,1177.0
98,Vintage 90s Black Leather Backpack Drawstring Rucksack,,85.0
99,Yves Saint Laurent Quilted Black Clutch with Gold Accent,,366.0
100,Kate Spade Grove Street Carli Colorblock Satchel,,35.0
101,"Vtg DOONEY and BOURKE signature canvas laptop bag, makeup bag bundle NWT",,175.0
102,Victoria's Secret Blush Quilted Crossbody Bag with mirror,,50.0
103,Gigi Crossbody‎ Handbag Women's Leather Camera Handbag Burgundy Wine Small,,52.0
104,Coach - VINTAGE HADLEY - USA - EXCELLENT CONDITION - Purple,,320.0
105,Michael Kors | Bay Large Woven Canvas Tote Bag | Shoulder Bag | Neon | Womens,,159.0
106,"Stylish book theme Tote Bag!
          
      NWT",,20.0
107,Emporio Armani Bag,,299.0
108,"🖤‎ FREE 🖤 *NEW* Sephora - 2018 Rouge Hand Bag
          
      NWT",,5.0
109,Never used bueno purse with pink flowers.,,14.0
110,Vintage 70s Hand Tooled Leather Saddle Bag Boho Whipstitch Purse,,80.0
111,"Juicy Couture Heart Shape Wristlet Wallet
          
      NWT",,30.0
112,"COACH Accordion Zip wallet in prairie print - 59014- NWT
          
      NWT",,150.0
113,"Michael Kors Kendall Small Rhinestone Embellished Shoulder Bag NEW
          
      NWT",,199.0
114,"Tory Burch T Monogram Jacquard Moon Crossbody Bag Blue
          
      NWT",,300.0
115,Dooney & Bourke leather Small Lexington,,99.0
116,"Badgley Mischka Quilted Studded Tote Bag Pink Vegan Leather Purse Crossbody
          
      NWT",,35.0
117,Vintage Fossil 1954 Leather Crossbody Purse,,40.0
118,"Patricia Nash Lanza Bag Womens Small Black Studded Coin Crossbody Leather Purse
          
      NWT",,130.0
119,"NWT! Kate Spade Small L-zip Bifold Wallet, Floral Pup, Cherrywood (ONE SIZE)
          
      NWT",,96.0
120,Leather Mini Backpack Purse Convertible Shoulder Bag Travel Fashion,,83.0
121,Vintage BURBERRY Haymaket Check Shoulder Tote Bag Canvas Coated Leather T-05-02,,280.0
122,LOUIS VUITTON Monogram Hampstead PM Hand Bag SP order M51168 LV Auth am2327gV,,3729.0
123,Daniella Bag Black Quilted Leather Crossbody Gold Chain Strap Evening Purse,,33.0
124,"New Purse Cross Bag Handmade Embroidered Colorful Patterned
          
      NWT",,43.0
125,Louis Vuitton Monogram Canvas Crossbody Bag Brown & Beige Trimmed,,1099.0
126,Teacher Bags for Women 15.6 Inch Laptop Work Tote Comfortable Quilted Shoulder,,92.0
127,"Wrangler Genuine Hair-On Cowhide Wide Tote/Crossbody Red
          
      NWT",,85.0
128,"NEW Women’s Kipling Kieko Blooming Pink Crossbody Bag
          
      NWT",,30.0
129,Michael Kors Black pebbled leather shoulder bag.,,55.0
130,Noonday Collective Valencia Summer Tote Beach Bag Bucket Nautical Blue White,,49.0
131,Vintage-Inspired Upcycled Neil Young Crazy Horse Album Graphic Tote Bag,,60.0
132,Olga Berg: Natasha Ball Mesh Clutch in Silver $85. Missing Clasp But Stays Close,,20.0
133,Coach Floral Flap Card Case,,82.0
134,"MICHAEL Michael Kors Lyra Small Zebra Print Calf Hair Pochette - NWT
          
      NWT",,309.0
135,Tommy Hilfiger sharp Black and Cream canvas monogram spacious satchel,,30.0
136,"Steve Madden White Purse Gold Chain Crossbody Handbag New
          
      NWT",,60.0
137,"Pick one! NWT genuine leather minimalist slim wallet credit card holder
          
      Boutique",,24.0
138,Coach Tote Retro 80s 90sSoho Boho Designer Spring Traditional Y2K Vermillion,,70.0
139,Tory Burch,,270.0
140,"Kate Spade Perri Lane Lynn Tote Ivory Leather
Very Gently Used",,69.0
141,Free People Distressed Black Leather Mini Crossbody Bag,,38.0
142,Louis Vuitton Hand Bag Houston Yellow Vernis,,314.0
143,"Kate Spade New York Black Sadie Crossbody Bag Saffiano Leather NWT
          
      NWT",,106.0
144,Tan Woven Purse,,15.0
145,NEW Kate Spade Wicker Satchel,,129.0
146,"FINAL PRICE -Brand New•TORY BURCH•Blue Ella Nylon Tote Bag
          
      NWT",,248.0
147,Croft & Barrow Tropical Leaf Cream Tan Green Bag Adjustable Strap (See All Pics),,18.0
148,Tory Burch half moon patent leather brown purse with crossbody strap,,158.0
149,"T.J.Maxx Football Print Tote Bag - Brown and Orange
          
      NWT",,9.0
150,Burberry Travel Bags,,740.0
151,Pink Victoria’s Secret Gym Duffle Weekender Bag,,40.0
152,SN & fashion. Deauty 1987 Crossbody Bag –,,34.0
153,Louis Vuitton Neverfull GM Bag,,499.0
154,"Chanel Vintage Spring 1999 Beaded Chainmail Bum Bag- NWT
          
      NWT",,2200.0
155,Tan Crossbody Bag,,21.0
156,Cole Haan Dillan Leather Tote Shoulder Bag Hobo Purse Cream,,89.0
157,Elegant Tutilo Two-Tone Crossbody Bag,,26.0
158,Vera Bradley Harry Potter,,75.0
159,Gucci authentic replacement parts for vintage bag NEW,,150.0
160,"Loeffler Randall Walker Suede Tote
          
      NWT",,225.0
161,Super Sweet Spring 🌺 Summer 🌻 Katie Doucette Casual Drawstring Backpack L👀k,,18.0
162,FjallRaven Kanken Rainbow Backpack for Everyday Warm Yellow / Rainbow,,35.0
163,Blazin‎ Roxx purse and wallet.,,25.0
164,COACH grey and beige adjustable crossbody,,125.0
165,Minnetonka Black Suede Fringe Crossbody Saddle Bag Boho Western Festival,,36.0
166,Fossil Vintage Black Explorer Crossbody,,55.0
167,Patricia Nash Shoulder Bag!,,75.0
168,100% Auth Prada Black Leather Wallet with Iconic Logo,,143.0
169,MIU MIU Continental Zip Aroundd Wallet in soft leather PINK IN MINT condition.,,212.0
170,"Brighton Under The Sea Cosmetic Pouch‎ new
          
      NWT",,75.0
171,PINK Victoria’s Secret Tropical 🩷💙 Ombre Palmtree 💙🩷 Tote Bag,,19.0
172,Floral Tote Bag with Pink and Green Accents,,24.0
173,Tan Coin Purse with Clip u.s polo assn,,8.0
174,"Tampa Bay Buccaneers Red Sling Bag, Backpack, Crossbody with Bucs Logo, Trendy",,16.0
175,Styline Catalina Tan & Cream Tones Woven Bag; Oval Bottom Zip Top Straw Look,,24.0
176,👜 Vintage Coach city bag  6790,,450.0
177,Louis Vuitton Speedy Top Handle Bag Damier Azur,,995.0
178,"Kate Spade Leila  Colorblock Large Continental Wallet In Warm Beige
          
      NWT",,120.0
179,Steve Madden Yellow Mini Bag with Top Handle and Detachable Chain Strap,,25.0
180,Vtg Bally Leather Camera Bag,,125.0
181,Mayfair Canvas Tote Everyone’s Welcome Here Green‎ Font,,30.0
182,Elegant tan Shoulder Bag,,21.0
183,Coach Pastel Pink Blue Beige Sateen Zip Wristlet Designer,,21.0
184,🌹Aupen Nirvana Noir Calfskin Bag,,135.0
185,Burberry Beige Accessory Pouch,,40.0
186,"Stylish Navy Tote Bag with Pink and Green Accents
          
      NWT",,59.0
187,Elegant Black Handbag and wallet set,,30.0
188,6.5x8.5” Alaia Paris Dust Bag,,40.0
189,Tag list,,100.0
190,Chic Tan Handbag with Gold Lock,,10.0
191,Hat club gift shopping bag,,6.0
192,"NWT! Lululemon Everywhere Belt Bag 1L
          
      NWT",,60.0
193,Pixie Mood Zoe Crossbody Purse in Olive Green,,35.0
194,Dooney & Bourke White Brown Leather Purse Satchel Doctors Bag,,125.0
195,Helen welsh black genuine leather satchel purse,,10.0
196,COACH - Madison pebble leather Phoebe satchel- F34495 -NWOT,,200.0
197,Fendi Black and Brown Logo Wallet | Very Good Condition,,269.0
198,HELLO KITTY TRAVEL COSMETIC GROOMING BAG,,28.0
199,Vera Pelle Navy Blue Leather Hobo Bag Ring Detail Whipstitch Made in Italy,,30.0
200,Kate Spade Midnight Black Zip-Around Wallet,,199.0
201,Vera Bradley Pink Woven Petal Paisley Straw Bucket Tote Beach Shoulder Bag Purse,,13.0
202,LOUIS VUITTON DELIGHTFUL MM size [EUC],,1850.0
203,Coach brown signs hobo bag,,216.0
204,Alba Two-Tone Leather Bucket Bag Vintage,,35.0
205,COACH Central Jumbo Whipstitch Pebble Leather Satchel/Crossbody Bag,,199.0
206,Gucci Large Guccissima Leather Wallet,,185.0
207,"NWT Michael Kors Mae Tote Purse Medium Leather Rose Color Bag
          
      NWT",,125.0
208,"💎✨BUNDLE OF 6✨💎AUTHENTIC Coach, Kate Spade, Gherardini Tote bags",,659.0
209,Beautiful Small Snakeskin Patterned Shoulder Bag,,15.0
210,"Relic Straw Women's Woven Tote Bag Leather Handles Summer Beach Shoulder Purse
          
      NWT",,45.0
211,"Trader Joe’s Mini Tote Bag New Limited Edition
          
      NWT",,25.0
212,"Juicy couture bestsellers barrel crossbody purse
          
      NWT",,60.0
213,Fluffy tote,,10.0
214,Vera Bradley Floral Patterned Duffle,,65.0
215,VIBEDRATION Rose Gold Holographic Water Backpack Festival Rave Travel Bladder,,48.0
216,Tumi Toiletry bag,,30.0
217,Coach Metallic Gold tag,,25.0
218,"Nine West Horse Whisperer Bag Brown Leather Crossbody Large Deadstock NWT $79
          
      NWT",,55.0
219,Vintage Coach Wristlet?,,100.0
220,Unionbay Tropical Cotton Sling Rope Bag Adjustable Strap Pockets College Office,,17.0
221,"Disney X Primark Winnie the Pooh Backpack
          
      NWT",,50.0
222,"Western Dark Brown Cowgirl Tweed Turquoise & Silver Crossbody Canvas Toole…
          
      NWT",,18.0
223,"Tory Burch Emerson Patent Leather Slim Card Case Royal Burgundy NWT
          
      NWT",,75.0
224,"MICHAEL KORS Jet Set Medium Metallic Logo Debossed Satchel
Cherry 
NWT",,179.0
225,Dagne Dover Signature Classic Tote Bag,,53.0
226,Chic Blue and Cream Tote Bag,,18.0
227,Black Lulu handbag,,10.0
228,"Tory Burch T Monogram Cat Printed Belt Bag Crossbody Bag Gray Cat Portrait
          
      NWT",,550.0
229,Vintage Franchi Collection Envelope Purse Handbag Red Paisley Textured Leather.,,28.0
230,New Free people hogan sling bag $98 belt bag blue,,66.0
231,Badgley Mischka‎ Black Gold Quilted Studded Shoulder Bag Chain Strap Elevate,,28.0
232,COACH VANVAS BIFOLD WALLET IN EXCELLENT USED CONDITION,,99.0
233,"KARL LAGERFELD PARIS
Nouvelle Mini Crossbody - Silver NWT
          
      NWT",,199.0
234,Liz Claiborne Brown Crossbody Bag,,25.0
235,Gucci GG Marmont Red Long Wallet,,349.0
236,DKNYC Black and Red Wristlet,,15.0
237,Fashion backpack in black and gold - NEW,,59.0
238,Vintage Dooney & Bourke Shoulder Bag,,32.0
239,Montana West Tan Embossed Clutch,,19.0
